{
  "id": "enter_torpor",
  "category": "energy_modulation",
  "description": "Enters metabolic torpor (hibernation-like state) to conserve energy during resource scarcity or environmental stress. Depth and minimum duration specify torpor intensity and commitment.",
  "parameter_schema": {
    "depth": {
      "type": "number",
      "range": {
        "min": 0,
        "max": 1
      },
      "units": "dimensionless",
      "default": 0.7
    },
    "min_duration_s": {
      "type": "number",
      "range": {
        "min": 60,
        "max": 604800
      },
      "units": "seconds",
      "default": 3600
    }
  },
  "composition_compatibility": [
    {
      "channel_family": "metabolic"
    },
    {
      "channel_family": "regulatory"
    }
  ],
  "cost_function": {
    "base_metabolic_cost": 0
  },
  "observable_signature": {
    "modality": "behavioral",
    "detection_range_m": 0,
    "pattern_key": "torpor_v1"
  },
  "provenance": "core"
}
