{
  "id": "emit_chemical_marker",
  "category": "signal_emission",
  "description": "Emits volatile chemical markers (pheromones, odor plumes) for attraction, territory marking, or alarm signaling. Persistence and specificity adjustable.",
  "parameter_schema": {
    "volatility": {
      "type": "number",
      "range": {
        "min": 0,
        "max": 1
      },
      "units": "dimensionless",
      "default": 0.6
    },
    "specificity": {
      "type": "number",
      "range": {
        "min": 0,
        "max": 1
      },
      "units": "dimensionless",
      "default": 0.7
    },
    "quantity_mg": {
      "type": "number",
      "range": {
        "min": 0.1,
        "max": 100
      },
      "units": "mg",
      "default": 5
    }
  },
  "composition_compatibility": [
    {
      "channel_family": "metabolic"
    },
    {
      "channel_family": "social"
    },
    {
      "channel_family": "reproductive"
    }
  ],
  "cost_function": {
    "base_metabolic_cost": 1.2,
    "parameter_scaling": [
      {
        "parameter": "quantity_mg",
        "exponent": 1.0,
        "coefficient": 0.08
      },
      {
        "parameter": "specificity",
        "exponent": 0.5,
        "coefficient": 0.4
      }
    ]
  },
  "observable_signature": {
    "modality": "chemical",
    "detection_range_m": 200,
    "pattern_key": "chemical_marker_pheromone"
  },
  "provenance": "core"
}
